{
  "$schema": "http://json-schema.org/draft-04/schema#",
  "$id": "https://raw.githubusercontent.com/umccr/orcabus/main/docs/schemas/events/sequencerunmanager/SequenceRunStateChange.schema.json",
  "description": "EventBridge custom event schema for orcabus.sequencerunmanager@SequenceRunStateChange",
  "title": "AWSEvent",
  "definitions": {
    "SequenceRunStateChange": {
      "type": "object",
      "required": [
        "id",
        "version",
        "orcabusId",
        "instrumentRunId",
        "runVolumeName",
        "runFolderPath",
        "runDataUri",
        "sampleSheetName",
        "startTime",
        "status"
      ],
      "properties": {
        "id": {
          "type": "string"
        },
        "version": {
          "type": "string"
        },
        "orcabusId": {
          "type": "string"
        },
        "instrumentRunId": {
          "type": "string"
        },
        "runVolumeName": {
          "type": "string"
        },
        "runFolderPath": {
          "type": "string"
        },
        "runDataUri": {
          "type": "string"
        },
        "sampleSheetName": {
          "type": ["string", "null"]
        },
        "startTime": {
          "type": "string",
          "format": "date-time"
        },
        "endTime": {
          "type": ["string", "null"],
          "format": "date-time"
        },
        "status": {
          "type": "string"
        },
        "stateCreatedBy": {
          "type": "string"
        }
      }
    }
  },
  "type": "object",
  "properties": {
    "id": {
      "type": "string"
    },
    "region": {
      "type": "string"
    },
    "resources": {
      "type": "array",
      "items": {
        "type": "string"
      }
    },
    "source": {
      "type": "string"
    },
    "time": {
      "format": "date-time",
      "type": "string"
    },
    "version": {
      "type": "string"
    },
    "account": {
      "type": "string"
    },
    "detail-type": {
      "type": "string"
    },
    "detail": {
      "$ref": "#/definitions/SequenceRunStateChange"
    }
  },
  "required": ["detail", "detail-type", "source"]
}
