{
  "version": "0",
  "id": "fffFfffe-5b36-40c2-f7dc-804ca6270cd6",
  "detail-type": "SequenceRunStateChange",
  "source": "orcabus.sequencerunmanager",
  "account": "123456789012",
  "time": "2024-05-01T09:25:44Z",
  "region": "ap-southeast-2",
  "resources": [],
  "detail": {
    "id": "8e50e37cf756387613e0f19675b6ba01",
    "version": "1.1.0",
    "orcabusId": "seq.0123456ABCDEFG",
    "instrumentRunId": "540424_A01001_0193_BBBBBBDRX5",
    "runVolumeName": "bssh.abcdefgh1234567899fa94fe79523959",
    "runFolderPath": "/Runs/540424_A01001_0193_BBBBBBDRX5_r.88888888ASU26EYuyeJHew",
    "runDataUri": "gds://bssh.abcdefgh1234567899fa94fe79523959/Runs/540424_A01001_0193_BBBBBBDRX5_r.88888888ASU26EYuyeJHew",
    "sampleSheetName": null,
    "startTime": "2024-04-27T03:45:02.113245Z",
    "endTime": null,
    "status": "STARTED"
  }
}
